{
  "$schema": ".adwf/schemas/managed-surface-policy.schema.json",
  "schema_version": 1,
  "role": "MANAGED_SURFACE_POLICY",
  "source_inventory": "MANIFEST.json",
  "source_checksums": "SHA256SUMS.txt",
  "default_manifest_ownership": "FRAMEWORK_PRIVATE",
  "default_unlisted_ownership": "CONSUMER_OWNED",
  "shared_guarded_paths": [
    ".gitattributes",
    ".gitignore",
    ".gitlab-ci.yml",
    "AGENTS.md",
    "CHANGELOG.md",
    "README.md",
    "SECURITY.md",
    "VERSION",
    "labels.json"
  ],
  "snapshot_schema": ".adwf/schemas/managed-surface-snapshot.schema.json",
  "plan_schema": ".adwf/schemas/managed-surface-plan.schema.json",
  "transaction_schema": ".adwf/schemas/managed-surface-transaction.schema.json",
  "detach_transaction_schema": ".adwf/schemas/managed-surface-detach-transaction.schema.json",
  "invariants": [
    "PROJECT_MUST_OUTLIVE_FRAMEWORK",
    "READ_ONLY_PLANNER_V1",
    "DRIFT_BLOCKS_DESTRUCTIVE_DETACH",
    "SHARED_GUARDED_PRESERVED",
    "TRANSACTIONAL_ADOPTION_APPLY_V1",
    "EXPLICIT_APPLY_ONLY",
    "NO_OVERWRITE_EXISTING_CONSUMER_PATH",
    "TRANSACTIONAL_GUARDED_DETACH_V1",
    "DESTRUCTIVE_AUTHORITY_REQUIRES_PROVENANCE"
  ]
}
